============================== nterm = 1
Least Square Fit:
  chi2/dof [dof] = 1.5e+04 [53]    Q = 0    logGBF = -3.9067e+05

Settings:
  svdcut/n = 0.002/9    tol = (1e-08*,1e-10,1e-10)    (itns/time = 35/0.1)

============================== nterm = 2
Least Square Fit:
  chi2/dof [dof] = 6.5 [53]    Q = 2.1e-44    logGBF = 1417.8

Settings:
  svdcut/n = 0.002/9    tol = (1e-08*,1e-10,1e-10)    (itns/time = 49/0.2)

============================== nterm = 3
Least Square Fit:
  chi2/dof [dof] = 0.68 [53]    Q = 0.97    logGBF = 1559.9

Settings:
  svdcut/n = 0.002/9    tol = (1e-08*,1e-10,1e-10)    (itns/time = 117/0.4)

============================== nterm = 4
Least Square Fit:
  chi2/dof [dof] = 0.68 [53]    Q = 0.96    logGBF = 1559.9

Parameters:
       log(a) 0      -1.5555 (58)       [ -1.2 (1.0) ]  
              1        -1.64 (35)       [ -1.2 (1.0) ]  
              2        -0.74 (16)       [ -1.2 (1.0) ]  
              3        -1.40 (91)       [ -1.2 (1.0) ]  
      log(dE) 0      0.27128 (55)       [  0.18 (17) ]  
              1        -0.93 (22)       [ -0.7 (1.0) ]  
              2        -0.87 (15)       [ -0.7 (1.0) ]  
              3        -0.83 (99)       [ -0.7 (1.0) ]  
      log(ao) 0        -2.76 (12)       [ -2.3 (1.0) ]  
              1        -2.14 (12)       [ -2.3 (1.0) ]  
              2        -2.60 (76)       [ -2.3 (1.0) ]  
              3        -2.47 (97)       [ -2.3 (1.0) ]  
     log(dEo) 0        0.341 (11)       [  0.41 (24) ]  
              1        -1.27 (19)       [ -0.7 (1.0) ]  
              2        -0.65 (92)       [ -0.7 (1.0) ]  
              3        -0.57 (98)       [ -0.7 (1.0) ]  
          Vnn 0       0.1065 (20)       [  0.00 (50) ]  
              1       -0.005 (30)       [  0.00 (50) ]  
              2        0.001 (85)       [  0.00 (50) ]  
              3        -0.15 (37)       [  0.00 (50) ]  
              4       0.004 (500)       [  0.00 (50) ]  
              5     0.0005 (4993)       [  0.00 (50) ]  
              6       0.002 (500)       [  0.00 (50) ]  
              7   0.00006 (50000)       [  0.00 (50) ]  
              8      3e-06 +- 0.5       [  0.00 (50) ]  
              9      2e-08 +- 0.5       [  0.00 (50) ]  
        Vno 0,0      -0.2104 (91)       [  0.00 (50) ]  
            0,1       -0.006 (43)       [  0.00 (50) ]  
            0,2         0.06 (17)       [  0.00 (50) ]  
            0,3        -0.03 (48)       [  0.00 (50) ]  
            1,0        0.016 (89)       [  0.00 (50) ]  
            1,1    -0.0003 (4998)       [  0.00 (50) ]  
            1,2     -3e-05 +- 0.5       [  0.00 (50) ]  
            1,3     0.0002 (5000)       [  0.00 (50) ]  
            2,0         0.03 (12)       [  0.00 (50) ]  
            2,1       0.002 (500)       [  0.00 (50) ]  
            2,2      2e-07 +- 0.5       [  0.00 (50) ]  
            2,3      1e-07 +- 0.5       [  0.00 (50) ]  
            3,0        -0.04 (48)       [  0.00 (50) ]  
            3,1    -0.0005 (5000)       [  0.00 (50) ]  
            3,2      2e-07 +- 0.5       [  0.00 (50) ]  
            3,3     -6e-10 +- 0.5       [  0.00 (50) ]  
          Voo 0       -0.091 (60)       [  0.00 (50) ]  
              1         0.02 (10)       [  0.00 (50) ]  
              2        -0.05 (43)       [  0.00 (50) ]  
              3        -0.02 (49)       [  0.00 (50) ]  
              4      -0.004 (500)       [  0.00 (50) ]  
              5    -0.0005 (5000)       [  0.00 (50) ]  
              6    -0.0008 (5000)       [  0.00 (50) ]  
              7     -4e-07 +- 0.5       [  0.00 (50) ]  
              8     -2e-07 +- 0.5       [  0.00 (50) ]  
              9     -1e-10 +- 0.5       [  0.00 (50) ]  
------------------------------------------------------
            a 0       0.2111 (12)       [  0.30 (30) ]  
              1        0.194 (67)       [  0.30 (30) ]  
              2        0.477 (75)       [  0.30 (30) ]  
              3         0.25 (22)       [  0.30 (30) ]  
           dE 0      1.31164 (72)       [  1.20 (20) ]  
              1        0.395 (86)       [  0.50 (50) ]  
              2        0.419 (64)       [  0.50 (50) ]  
              3         0.44 (43)       [  0.50 (50) ]  
           ao 0       0.0633 (79)       [  0.10 (10) ]  
              1        0.118 (14)       [  0.10 (10) ]  
              2        0.074 (56)       [  0.10 (10) ]  
              3        0.085 (82)       [  0.10 (10) ]  
          dEo 0        1.407 (15)       [  1.50 (36) ]  
              1        0.282 (55)       [  0.50 (50) ]  
              2         0.52 (48)       [  0.50 (50) ]  
              3         0.56 (55)       [  0.50 (50) ]  

Settings:
  svdcut/n = 0.002/9    tol = (1e-08*,1e-10,1e-10)    (itns/time = 79/0.4)


Values:
                mDs: 1.31164(72)         
                Vnn: 0.1065(20)          

Partial % Errors:
                  mDs       Vnn
-------------------------------
statistics:      0.05      1.16
 Ds priors:      0.02      0.51
  V priors:      0.00      1.37
-------------------------------
     total:      0.06      1.88


==================== add svd, prior noise
Least Square Fit:
  chi2/dof [dof] = 0.94 [53]    Q = 0.6    logGBF = 1552.8

Settings:
  svdcut/n = 0.002/9*    tol = (1e-08*,1e-10,1e-10)    (itns/time = 237/1.1)

      fit: {'a': 0.2111(12),'dE': 1.31164(72),'Vnn': 0.1065(20)}
noisy fit: {'a': 0.2109(11),'dE': 1.31155(69),'Vnn': 0.1080(29)}
           chi2/dof = 0.47 [3]    Q = 0.7

==================== simulation
Least Square Fit:
  chi2/dof [dof] = 0.61 [53]    Q = 0.99    logGBF = 1562.9

Settings:
  svdcut/n = 0.002/9    tol = (1e-08*,1e-10,1e-10)    (itns/time = 84/0.4)

simulated - exact: {'a': 0.0001(10),'dE': -0.00019(64),'Vnn': -0.0004(18)}
           chi2/dof = 1.4 [3]    Q = 0.25

==================== simulation
Least Square Fit:
  chi2/dof [dof] = 0.64 [53]    Q = 0.98    logGBF = 1561.2

Settings:
  svdcut/n = 0.002/9    tol = (1e-08*,1e-10,1e-10)    (itns/time = 94/0.4)

simulated - exact: {'a': -0.0002(13),'dE': -0.00020(74),'Vnn': 0.0018(30)}
           chi2/dof = 0.27 [3]    Q = 0.85
