============================== nterm = 1
Least Square Fit:
  chi2/dof [dof] = 5.8e+03 [69]    Q = 0    logGBF = -1.9877e+05

Settings:
  svdcut/n = 8e-05/22    tol = (1e-08*,1e-10,1e-10)    (itns/time = 26/0.1)

============================== nterm = 2
Least Square Fit:
  chi2/dof [dof] = 2.2 [69]    Q = 2.8e-08    logGBF = 1546.1

Settings:
  svdcut/n = 8e-05/22    tol = (1e-08*,1e-10,1e-10)    (itns/time = 32/0.1)

============================== nterm = 3
Least Square Fit:
  chi2/dof [dof] = 0.58 [69]    Q = 1    logGBF = 1593.5

Settings:
  svdcut/n = 8e-05/22    tol = (1e-08*,1e-10,1e-10)    (itns/time = 47/0.2)

============================== nterm = 4
Least Square Fit:
  chi2/dof [dof] = 0.58 [69]    Q = 1    logGBF = 1594

Parameters:
  log(etas:a) 0     -1.52169 (74)       [ -1.2 (1.0) ]  
              1        -1.74 (39)       [ -1.2 (1.0) ]  
              2        -1.20 (47)       [ -1.2 (1.0) ]  
              3        -1.27 (96)       [ -1.2 (1.0) ]  
 log(etas:dE) 0     -0.87663 (28)       [ -0.92 (50) ]  
              1        -0.52 (14)       [ -0.7 (1.0) ]  
              2        -0.81 (65)       [ -0.7 (1.0) ]  
              3        -0.66 (97)       [ -0.7 (1.0) ]  
    log(Ds:a) 0     -1.53866 (95)       [ -1.2 (1.0) ]  
              1       -1.298 (93)       [ -1.2 (1.0) ]  
              2        -0.76 (40)       [ -1.2 (1.0) ]  
              3        -1.11 (99)       [ -1.2 (1.0) ]  
   log(Ds:dE) 0      0.18370 (14)       [  0.18 (17) ]  
              1       -0.691 (41)       [ -0.7 (1.0) ]  
              2        -0.62 (37)       [ -0.7 (1.0) ]  
              3        -0.76 (99)       [ -0.7 (1.0) ]  
   log(Dso:a) 0        -2.72 (11)       [ -2.3 (1.0) ]  
              1        -2.50 (38)       [ -2.3 (1.0) ]  
              2        -2.17 (81)       [ -2.3 (1.0) ]  
              3        -2.3 (1.0)       [ -2.3 (1.0) ]  
  log(Dso:dE) 0       0.3680 (93)       [  0.41 (24) ]  
              1        -1.46 (49)       [ -0.7 (1.0) ]  
              2        -0.69 (78)       [ -0.7 (1.0) ]  
              3        -0.7 (1.0)       [ -0.7 (1.0) ]  
        Vnn 0,0      0.76716 (85)       [  0.0 (1.0) ]  
            0,1       -0.491 (39)       [  0.0 (1.0) ]  
            0,2         0.39 (48)       [  0.0 (1.0) ]  
            0,3         0.05 (99)       [  0.0 (1.0) ]  
            1,0        0.060 (46)       [  0.0 (1.0) ]  
            1,1         0.38 (77)       [  0.0 (1.0) ]  
            1,2       0.03 (1.00)       [  0.0 (1.0) ]  
            1,3     0.002 (1.000)       [  0.0 (1.0) ]  
            2,0        -0.11 (24)       [  0.0 (1.0) ]  
            2,1       0.04 (1.00)       [  0.0 (1.0) ]  
            2,2     0.001 (1.000)       [  0.0 (1.0) ]  
            2,3        5e-05 +- 1       [  0.0 (1.0) ]  
            3,0      -0.002 (981)       [  0.0 (1.0) ]  
            3,1     0.003 (1.000)       [  0.0 (1.0) ]  
            3,2        3e-05 +- 1       [  0.0 (1.0) ]  
            3,3        5e-07 +- 1       [  0.0 (1.0) ]  
        Vno 0,0       -0.778 (76)       [  0.0 (1.0) ]  
            0,1         0.30 (32)       [  0.0 (1.0) ]  
            0,2        -0.02 (88)       [  0.0 (1.0) ]  
            0,3     0.007 (0.998)       [  0.0 (1.0) ]  
            1,0         0.26 (44)       [  0.0 (1.0) ]  
            1,1         0.17 (96)       [  0.0 (1.0) ]  
            1,2     0.005 (0.999)       [  0.0 (1.0) ]  
            1,3   0.0001 (1.0000)       [  0.0 (1.0) ]  
            2,0        -0.14 (94)       [  0.0 (1.0) ]  
            2,1     0.003 (1.000)       [  0.0 (1.0) ]  
            2,2   0.0006 (1.0000)       [  0.0 (1.0) ]  
            2,3        1e-05 +- 1       [  0.0 (1.0) ]  
            3,0      -0.02 (1.00)       [  0.0 (1.0) ]  
            3,1    -0.002 (1.000)       [  0.0 (1.0) ]  
            3,2        9e-06 +- 1       [  0.0 (1.0) ]  
            3,3        3e-07 +- 1       [  0.0 (1.0) ]  
------------------------------------------------------
       etas:a 0      0.21834 (16)       [  0.30 (30) ]  
              1        0.176 (69)       [  0.30 (30) ]  
              2         0.30 (14)       [  0.30 (30) ]  
              3         0.28 (27)       [  0.30 (30) ]  
      etas:dE 0      0.41618 (12)       [  0.40 (20) ]  
              1        0.597 (83)       [  0.50 (50) ]  
              2         0.45 (29)       [  0.50 (50) ]  
              3         0.52 (50)       [  0.50 (50) ]  
         Ds:a 0      0.21467 (20)       [  0.30 (30) ]  
              1        0.273 (25)       [  0.30 (30) ]  
              2         0.47 (19)       [  0.30 (30) ]  
              3         0.33 (32)       [  0.30 (30) ]  
        Ds:dE 0      1.20165 (16)       [  1.20 (20) ]  
              1        0.501 (21)       [  0.50 (50) ]  
              2         0.54 (20)       [  0.50 (50) ]  
              3         0.47 (46)       [  0.50 (50) ]  
        Dso:a 0       0.0657 (73)       [  0.10 (10) ]  
              1        0.082 (31)       [  0.10 (10) ]  
              2        0.115 (93)       [  0.10 (10) ]  
              3         0.10 (10)       [  0.10 (10) ]  
       Dso:dE 0        1.445 (13)       [  1.50 (36) ]  
              1         0.23 (11)       [  0.50 (50) ]  
              2         0.50 (39)       [  0.50 (50) ]  
              3         0.49 (48)       [  0.50 (50) ]  

Settings:
  svdcut/n = 8e-05/22    tol = (1e-08*,1e-10,1e-10)    (itns/time = 19/0.1)

Fit results:
  Eetas: [0.41618(12) 1.013(83) 1.46(36)]
  aetas: [0.21834(16) 0.176(69) 0.30(14)]

  EDs: [1.20165(16) 1.703(21) 2.24(22)]
  aDs: [0.21467(20) 0.273(25) 0.47(19)]

  EDso: [1.445(13) 1.68(12) 2.18(45)]
  aDso: [0.0657(73) 0.082(31) 0.115(93)]

  etas->V->Ds  = 0.76716(85)

Values:
              metas: 0.41618(12)         
                mDs: 1.20165(16)         
                Vnn: 0.76716(85)         

Partial % Errors:
                  metas       mDs       Vnn
-------------------------------------------
  statistics:      0.03      0.01      0.09
         svd:      0.00      0.00      0.03
 log(etas:a):      0.00      0.00      0.01
log(etas:dE):      0.00      0.00      0.01
   log(Ds:a):      0.00      0.00      0.02
  log(Ds:dE):      0.00      0.00      0.02
  log(Dso:a):      0.00      0.00      0.01
 log(Dso:dE):      0.00      0.00      0.01
         Vnn:      0.00      0.00      0.04
         Vno:      0.00      0.00      0.01
-------------------------------------------
       total:      0.03      0.01      0.11




==================== add svd, prior noise
Least Square Fit:
  chi2/dof [dof] = 0.93 [69]    Q = 0.63    logGBF = 1581

Settings:
  svdcut/n = 8e-05/22*    tol = (1e-08*,1e-10,1e-10)    (itns/time = 201/0.8)

      fit: {'etas:a': 0.21834(16),'etas:dE': 0.41618(12),'Ds:a': 0.21467(20),'Ds:dE': 1.20165(16),'Vnn': 0.76716(85)}
noisy fit: {'etas:a': 0.21834(16),'etas:dE': 0.41619(12),'Ds:a': 0.21459(27),'Ds:dE': 1.20162(18),'Vnn': 0.7656(16)}
           chi2/dof = 0.4 [5]    Q = 0.85

==================== simulation
Least Square Fit:
  chi2/dof [dof] = 0.35 [69]    Q = 1    logGBF = 1601.6

Settings:
  svdcut/n = 8e-05/24    tol = (1e-08*,1e-10,1e-10)    (itns/time = 58/0.3)

simulated - exact: {'etas:a': -0.00009(17),'etas:dE': -0.00007(12),'Ds:a': -2(200)e-06,'Ds:dE': -0.00002(16),'Vnn': -0.0003(11)}
           chi2/dof = 0.11 [5]    Q = 0.99

==================== simulation
Least Square Fit:
  chi2/dof [dof] = 0.66 [69]    Q = 0.99    logGBF = 1591.1

Settings:
  svdcut/n = 8e-05/24    tol = (1e-08*,1e-10,1e-10)    (itns/time = 49/0.2)

simulated - exact: {'etas:a': 0.00008(16),'etas:dE': 0.00007(12),'Ds:a': -0.00003(25),'Ds:dE': 0.00006(18),'Vnn': 0.0003(13)}
           chi2/dof = 0.21 [5]    Q = 0.96
